[
    {
        "order":  1,
        "headline":  "Task based",
        "images":  [

                   ],
        "prompt":  "An OTR is planning a session for a 15-month-old toddler who has mild hypotonia secondary to a perinatal cerebellar CVA. The toddler has achieved developmental milestones in all areas with the exception of fine motor skill development. Which technique would be MOST BENEFICIAL to include as part of the initial intervention for improving the toddler\u0027s fine motor skills during play?",
        "options":  [
                        {
                            "key":  "A",
                            "label":  "Use games and activities that promote proximal stability."
                        },
                        {
                            "key":  "B",
                            "label":  "Provide activities that can be completed on a horizontal plane."
                        },
                        {
                            "key":  "C",
                            "label":  "Place age-appropriate toys in midline close to the toddler\u0027s body."
                        }
                    ],
        "answerKey":  [
                          "A"
                      ],
        "content":  "**Why this is right:** Strengthening proximal control is foundational for toddlers with hypotonia. Co-contraction at the shoulders and trunk lets the forearm and hand dissociate for grasp, release, and in-hand manipulation during play. Proximal stability also supports postural reactions that keep the toddler upright while exploring toys.\n\n**Why the others miss:**\n- **B. Provide activities on a horizontal plane.** This compensates for weak shoulders but never builds the proximal strength required for refined manipulation.\n- **C. Place toys in midline.** Presenting toys close to the body reduces reach demands yet does nothing to remediate the motor impairment limiting fine-motor development.\n\n**Book anchor:** Case-Smith \u0026 O\u0027Brien, Occupational Therapy for Children and Adolescents, 8th ed., Chapter 18 (Neuromotor and Sensorimotor Interventions) highlights targeting proximal stability before expecting distal control in toddlers with hypotonia.",
        "bookAnswer":  {
                           "title":  "Case-Smith \u0026 O\u0027Brien, Occupational Therapy for Children and Adolescents",
                           "excerpt":  "Chapter 18 outlines neuromotor and sensorimotor strategies that build proximal stability and postural control before expecting refined fine-motor play.",
                           "source":  "Case-Smith \u0026 O\u0027Brien, Occupational Therapy for Children and Adolescents, 8th ed., Chapter 18"
                       }
    },
    {
        "order":  2,
        "headline":  "Task based",
        "images":  [

                   ],
        "prompt":  "A client has a localized staphylococcus aureus infection from a surgical incision on the hand. The client is participating in OT to decrease swelling and increase active ROM of the affected hand. What infection control method should the OTR use when working with this client?",
        "options":  [
                        {
                            "key":  "A",
                            "label":  "Provide the intervention in an isolation room."
                        },
                        {
                            "key":  "B",
                            "label":  "Adhere to standard precautions."
                        },
                        {
                            "key":  "C",
                            "label":  "Have the client wear a glove over the wound."
                        }
                    ],
        "answerKey":  [
                          "B"
                      ],
        "content":  "**Why this is right:** A localized Staphylococcus aureus infection is managed with standard precautions. Perform hand hygiene, don gloves when contacting drainage, and keep equipment clean while maintaining a covered wound so therapy remains accessible and safe.\n\n**Why the others miss:**\n- **A. Isolation room.** Contact isolation is reserved for uncontrolled drainage or aerosol-generating procedures, not routine hand therapy with a covered wound.\n- **C. Glove over the wound.** A glove traps moisture, raises infection risk, and is not recommended for wound coverage.\n\n**Book anchor:** Centers for Disease Control and Prevention. Standard Precautions for All Patient Care (2023) clarifies that gloves and hand hygiene are sufficient for localized skin infections without automatic isolation.",
        "bookAnswer":  {
                           "title":  "CDC Standard Precautions Guidance",
                           "excerpt":  "The CDC Standard Precautions guideline directs clinicians to pair meticulous hand hygiene with gloves and covered wounds when treating localized infections.",
                           "source":  "Centers for Disease Control and Prevention, Standard Precautions for All Patient Care, 2023"
                       }
    },
    {
        "order":  3,
        "headline":  "Task based",
        "images":  [

                   ],
        "content":  "**Why this is right:** A home assessment lets the OTR observe real bathroom transfers, identify hazards, recommend adaptive equipment, and rehearse strategies that directly reduce the patient\u0027s fear of falling before discharge.\n\n**Why the others miss:**\n- **A. Provide handouts.** Generic printouts cannot verify equipment fit or ensure carryover in the family\u0027s actual bathroom.\n- **B. Recommend a fall-prevention class.** Delays addressing the immediate safety concerns during transition home.\n\n**Book anchor:** Pedretti \u0026 Early, Occupational Therapy for Physical Dysfunction, 8th ed., Chapter 19 stresses using home visits to tailor bathroom modifications and caregiver training prior to discharge.",
        "prompt":  "A patient has Friedreich\u0027s ataxia and will be discharged in 2 days from an inpatient rehabilitation facility to live at home with family. The patient is afraid of falling, especially during ADL in the bathroom. What action is MOST IMPORTANT for the OTR to take to reduce the patient\u0027s fear and promote a safe transition to home?",
        "options":  [
                        {
                            "key":  "A",
                            "label":  "Provide the family members with handouts about home safety and fall risks."
                        },
                        {
                            "key":  "B",
                            "label":  "Recommend the patient and family attend a post-discharge fall prevention class."
                        },
                        {
                            "key":  "C",
                            "label":  "Assess the home layout to advise the family about modifying potential fall hazards."
                        }
                    ],
        "answerKey":  [
                          "C"
                      ],
        "bookAnswer":  {
                           "title":  "Pedretti \u0026 Early, Occupational Therapy for Physical Dysfunction",
                           "excerpt":  "Chapter 27 discusses discharge planning and home safety evaluations, including caregiver instruction and adaptive equipment selection to reduce fall risk.",
                           "source":  "Pedretti \u0026 Early, Occupational Therapy for Physical Dysfunction, 8th ed., Chapter 27"
                       }
    },
    {
        "order":  4,
        "headline":  "Task based",
        "images":  [

                   ],
        "content":  "**Why this is right:** Standardized screening tools must be administered exactly as written. Providing the scripted repeat directions preserves validity so scores remain comparable across examiners and settings.\n\n**Why the others miss:**\n- **A. Model the task.** Physical cueing adds examiner assistance that invalidates the standardized norms.\n- **C. Simplify instructions.** Altering wording changes task demands and compromises reliability.\n\n**Book anchor:** O\u0027Brien \u0026 Hussey, Introduction to Occupational Therapy, 5th ed., Chapter 10 reinforces that standardized assessments require adherence to the manual\u0027s directions to maintain reliability and validity.",
        "prompt":  "During the administration of a standardized screening instrument, a child demonstrates difficulty initiating a motor task. What action should the OTR take in this situation?",
        "options":  [
                        {
                            "key":  "A",
                            "label":  "Model how to start the task and provide tactile cues."
                        },
                        {
                            "key":  "B",
                            "label":  "Follow the test protocol for giving additional directions."
                        },
                        {
                            "key":  "C",
                            "label":  "Simplify the verbal instructions to enhance comprehension."
                        }
                    ],
        "answerKey":  [
                          "B"
                      ],
        "bookAnswer":  {
                           "title":  "O\u0027Brien \u0026 Hussey, Introduction to Occupational Therapy",
                           "excerpt":  "Chapter 10 reinforces that standardized assessments must follow the manual\u0027s directions verbatim to preserve reliability and validity.",
                           "source":  "O\u0027Brien \u0026 Hussey, Introduction to Occupational Therapy, 5th ed., Chapter 10"
                       }
    },
    {
        "order":  5,
        "headline":  "Task based",
        "images":  [

                   ],